"total_march_covid_deaths","Name","Population","Land.area.mi.2.","Water.area.mi.2.","state_num","flesch","favorite_count","id","lang","text","user_location"
3191,"New York","19,453,561","47,126","7,429",32,11.13,0,1238441195031887872,"en","Dear @Snowden it is always the moment to buy #bitcoin @giacomozucco @adam3us @APompliano #Covid_19 #coronavir","New York"
62,"Oregon","4,217,737","95,988","2,391",37,72.325,0,1238355983660806144,"en","Schools close, Tom Hanks, trouble in the big banks, no vaccine, quarantine, no more toilet paper seen. Travel ban, Weinste","Oregon, USA"
62,"Oregon","4,217,737","95,988","2,391",37,57.605,0,1238356466592968704,"en","In the midst of a national pandemic, should we nominate someone who has devoted their life to the cause of universal healt","Oregon, USA"
814,"California","39,512,223","155,779","7,916",5,40.6131578947368,0,1239681815515807744,"en","How Jair Bolsonaros Son, Eduardo, Confirmed His Fathers Positive Coronavirus Test to Fox News, Then Lied About It htt","California, USA"
111,"South Carolina","5,148,714","30,061","1,960",40,31.97,0,1234002726813667328,"en","Obama Declares National Health Emergency After 1000 Swine Flu Deaths Praised For Leadership #PresidentTrump Declares Na","South Carolina, USA"
814,"California","39,512,223","155,779","7,916",5,80.0976470588235,0,1239675088061886464,"en","And still we dont even know if people in our jails are getting testing, treatment... or soap.","California, USA"
859,"Pennsylvania","12,801,989","44,743","1,312",38,82.39,0,1237581883447230464,"en","Yikes. That's a horse of a different color.","Suburban Pennsylvania, USA"
814,"California","39,512,223","155,779","7,916",5,53.12,0,1237575457559592960,"en","This news makes me question if the proper authorties are taking the COVID-19 outbreak seriously enough.","California "
62,"Oregon","4,217,737","95,988","2,391",37,40.2858823529412,0,1239675096156893184,"en","Wives of world leaders keep testing positive. Just a remarkable coincidence that the leaders never test positive.","Oregon, USA"
0,"West Virginia","1,792,147","24,038","192",48,72.6154545454546,0,1234093564449169408,"en","@_HellzBellz Thought you didn't like Corona? Kidding, it's Sunday, rest up.","Harrisville, WV "
37,"Iowa","3,155,070","55,857","416",15,76.556,0,1241145866905440256,"en","I said this once and Ill say it again. The quicker they mandate a 14 day USA lockdown so that the virus cant move around","Iowa"
79,"North Carolina","10,488,084","48,618","5,201",33,31.97,0,1244257520618737664,"en","says the President downplaying the severity of #coronavirus is deadly."" As the President fiddles, people ar","North Carolina, USA"
173,"Arizona","7,278,717","113,594","396",3,50.4528571428572,5,1243362308891369472,"en","If you were tested positive for covid-19 but were asymptomatic and would never get sick from it, would you stay home? Or would you go somewhere knowing you were contagious? Its a free-for-all out there","Phoenix, AZ now. Seattle b4"
499,"Georgia","10,617,423","57,513","1,912",10,45.0657894736842,0,1243593729631494144,"en","Michigan Governor Gretchen Whitmer is auditioning to be Joe Bidens running mate. Shes focused more on playing politics with","Georgia"
510,"Washington","7,614,893","66,456","4,842",47,18.35,0,1243594442889723904,"en","The coronavirus pandemic is delaying vital maintenance across the oil and natural gas industries in Europe and North America"," WashingtonDC/NYC/Sthlm/Stgo"
510,"Washington","7,614,893","66,456","4,842",47,37.4672727272728,60,1241128133513920512,"en","A little spring cleaning this weekend can go a long way toward managing your #COVID19 anxiety. @drmatompkins explains how decluttering can help us feel more relaxed and re-establish a healthy sense of control.","Washington, DC"
152,"Missouri","6,137,428","68,742","965",25,80.465,0,1243374564643495936,"en","I'd love for Trump to assist my daughter working as an ICU nurse in CA, treating Covid pat","Missouri, USA"
312,"Ohio","11,689,100","40,861","3,965",35,57.605,0,1236795478404145152,"en","Cruz says the interaction with the person who tested positive for coronavirus lasted less than a minute. He does not have any","Ohio"
436,"Indiana","6,732,219","35,826","593",14,9.70000000000002,0,1237559514540326912,"en","Democrat Ilhan Omar is spreading propaganda from communist China:","Indianapolis, IN"
76,"Minnesota","5,639,632","79,627","7,309",23,94.3,0,1234115373462687744,"en","It's time to call out China's BS! via @YouTube","Minnesota, USA"
22,"Idaho","1,787,065","82,643","926",12,40.6131578947368,0,1236794801955061760,"en","Trump calls Inslee a 'snake' amid coronavirus outbreak in Washington state | TheHill ""I told Mike not to be complimentary","Boise, Idaho"
626,"Florida","21,477,737","53,625","12,133",9,47.565,0,1236800522876788736,"en","CORONAVIRUS - - 90% of DEATHS, 75% of CASES - ALL in WASHINGTON STATE &amp; SENIOR CENTER ** Coronavirus deaths in the","Vero Beach Florida"
79,"North Carolina","10,488,084","48,618","5,201",33,52.5771428571429,0,1234106458318438400,"en","Less than a month ago, and weeks after COVID-19 had been recognized as a virus with pandemic potential, the Trump Administra","North Carolina"
477,"Connecticut","3,565,278","4,842","701",7,65.7856521739131,0,1234016738557165568,"en","We should not have to listen to three politicians before we hear from a doctor. And, the WH continues to lie about the","Connecticut, USA"
814,"California","39,512,223","155,779","7,916",5,41.5535714285714,0,1234113667664244736,"en","Coronavirus will spread in California, health officials say: 'Its already out of the bag'","California, USA"
0,"Hawaii","1,415,872","6,423","4,509",11,68.095,0,1234020842897457152,"en","In Daegu, 1900 Shincheonji Church members have been tested for coronavirus. 1300 had symptoms &amp; 600 did not. Among those","Hawaii, USA"
98,"Kentucky","4,467,673","39,486","921",17,69.1413636363636,0,1236789387066847232,"en","Updated: A UK spokesman said that none of the 3 new confirmed cases are in UK hospitals. The state's first confirmed coro","Lexington, Kentucky"
3191,"New York","19,453,561","47,126","7,429",32,40.6131578947368,0,1234024248668282880,"en","BREAKING NEWS!!! The Japan Sumo Association has decided to hold the upcoming tournament in Osaka behind closed doors be","New York, NY"
367,"Texas","28,995,881","261,232","7,365",43,29.4936363636364,0,1242790419936751616,"en","@paulosophia @believingher @CuomoPrimeTime We know he uses Easter Sunday for a photo op pretending hes a Christian. What he really wants is to golf and start those hateful rallies again. He needs to feed his ego. Im not going to church bc he says so. Ill go when the #COVID19 cases trickle down to zero","College-ed woman trying to turn TX Blue!"
152,"Missouri","6,137,428","68,742","965",25,65.2959090909091,0,1242692780566118400,"en","Sen. Tom Cotton: ""Here it is again in a bill designed to stop the pandemic. Are you kidding me? $15-an-hour minimum wage.","Missouri"
173,"Arizona","7,278,717","113,594","396",3,95.165,0,1234674522281742336,"en","I think they are picking and choosing who gets it!","Arizona, USA"
0,"West Virginia","1,792,147","24,038","192",48,63.4861538461539,0,1235319916389167104,"en","if youve ever used a frat house bathroom youre immune to the coronavirus","West Virginia, USA"
125,"Mississippi","2,976,149","46,923","1,508",24,17.445,0,1234871895868297216,"en","Floridians, you cannot shoot the coronavirus.","Mississippi Gulf Coast, USA"
76,"Minnesota","5,639,632","79,627","7,309",23,10.82,0,1234884398266408960,"en","Student at Sarasota Military Academy whose classmates shook hands with Mike Pence now under coronavirus quarantine","Minnesota, USA"
113,"Nevada","3,080,156","109,781","791",28,54,7,1234662850628444160,"en","As it is in most (all?) other developed countries. Even if the GOP idiots can't do it for the right reason - because it's simply the right thing to do - they should do it because it ends up being cheaper in the long run. Far cheaper.","Las Vegas, NV and elsewhere"
3191,"New York","19,453,561","47,126","7,429",32,-1.59076923076918,0,1234853700234924032,"en","RELEASE: @MDHealthDept released public service announcements regarding #COVID19 preparedness efforts. Everyone can play","New York, USA"
3725,"New Jersey","8,882,190","7,354","1,368",30,62.625,0,1241816850658398208,"en","Glad the senator is feeling well! And also...how did he get a test if he was asymptomatic and had no known contact with s","New Jersey"
814,"California","39,512,223","155,779","7,916",5,65.7856521739131,0,1234845870530547712,"en","I live in Seattle, I have all symptoms of COVID-19 and have a history of chronic bronchitis. Since I work in a physic","California, USA"
814,"California","39,512,223","155,779","7,916",5,80.6868421052632,0,1234634413087969280,"en","this is the BEST set of info Ive found on corona virus and its worth watching the full 10mins","California, USA"
79,"North Carolina","10,488,084","48,618","5,201",33,36.4628571428572,0,1235132828452638720,"en","If I do get the Coronavirus Im attending every MAGA rally I can - Denver Communist Official Says She Will Use Deadly","North Carolina, USA"
814,"California","39,512,223","155,779","7,916",5,69.1413636363636,0,1234640075700330496,"en","I'm going to stop posting Covid-19 prep. Too many people jumping on me saying I'm feeding panic. Does anyone else think tha","California, USA"
3191,"New York","19,453,561","47,126","7,429",32,3.345,0,1.234634387272e+18,"en","Paranoid Politics Goes Viral via @instapaper","New York, NY"
62,"Oregon","4,217,737","95,988","2,391",37,63.4861538461539,0,1238333523070615552,"en","Katie Porter just saved countless lives. Thank you thank you thank you @katieporteroc","Oregon, USA"
398,"Colorado","5,758,736","103,642","452",6,-12.8321428571428,0,1240338974964699136,"en","CORONAVIRUS SPECIAL Esteemed physician, vaccine scientist, and professor @PeterHotez joined @Alyssa_Milano to share t","Colorado, USA"
859,"Pennsylvania","12,801,989","44,743","1,312",38,42.716,3,1242670051548856320,"en","Tell Globalist Pelosi to stick it where the sun don't shine. Don't come back unless they have a serious proposal that addresses Americans &amp; coronavirus.","Pennsylvania, USA"
173,"Arizona","7,278,717","113,594","396",3,38.485,0,1239658361051725824,"en","Also a moratorium on evicting our public housing tenants, no water shutoffs for those behind in their payments, a commitmen","Tempe, Arizona"
367,"Texas","28,995,881","261,232","7,365",43,50.665,0,1237541911663017984,"en","The only man who can defeat the Coronavirus","Texas, USA"
167,"Wisconsin","5,822,434","54,158","11,339",49,103.7,0,1237744185375162368,"en","Thank you Gavin. Team is doing a great job!","Wisconsin, USA"
367,"Texas","28,995,881","261,232","7,365",43,40.6131578947368,0,1237749797492273152,"en","Your paid subscriptions to SHERO allow me to continue publishing critical and informative pieces for the public. In th","Texas"
814,"California","39,512,223","155,779","7,916",5,49.9140909090909,0,1237529664060411904,"en","In a wide-ranging press conference, Gov. Gavin Newsom said that 157 people in California have now tested positive for the new #co","California"
111,"South Carolina","5,148,714","30,061","1,960",40,42.865,0,1239659111924600832,"en","After plan to re-evaluate coronavirus threat in early April with hopes of continuing junior college springs sports and","South Carolina"
859,"Pennsylvania","12,801,989","44,743","1,312",38,60.705,1,1237529739381706752,"en","For Trump, Coronavirus Proves to Be an Enemy He Cant Tweet Away","Pennsylvania, USA"
626,"Florida","21,477,737","53,625","12,133",9,60.1917647058824,0,1234080905318273024,"en","A dog has tested positive for the Coronavirus. White people about to find a cure ASAP now","Florida"
510,"Washington","7,614,893","66,456","4,842",47,53.6392857142857,0,1233981086486683648,"en","Mike Pence wipes nose before shaking hands with top doctors at coronavirus press conference","Washington, DC"
367,"Texas","28,995,881","261,232","7,365",43,16.9581818181818,5,1233995061202948096,"en","@KathyBooker11 @darinp2 @chinatown2049 @trvrb @seattleflustudy This is so stupid. Everyone politicizing the Covid-19. It's like everyone woke up a week ago and realized ""This is a great opportunity to further polarize the country!"""," Texas "
814,"California","39,512,223","155,779","7,916",5,35.2,0,1235997162699280384,"en","Ppl are trying to create a huge epidemic out of the coronavirus because of the politics as of now. Every year there is something new around election time and it's as if it's to test the running candidates to see who can handle it better.","Torrance, California"
367,"Texas","28,995,881","261,232","7,365",43,58.4291304347826,0,1235992125352837120,"en","If you only have 1 tool in your toolbox, every issue looks the same. With mass global air travel, @realDonaldTrumps idea he c","Texas, USA"
107,"Oklahoma","3,956,971","68,595","1,304",36,89.5169230769231,0,1233986409041727488,"en","Can't have any women in the room. Wouldn't want Mother to get upset.","Oklahoma, USA"
98,"Kentucky","4,467,673","39,486","921",17,3.39727272727274,0,1234078623881146368,"en","Trump sets new travel restrictions over coronavirus, considering southern border shutdown","Kentucky, USA"
367,"Texas","28,995,881","261,232","7,365",43,25.3564705882353,0,1236759717646663680,"en","16/ Thoughts on how to deal w/ information/misinformation during #COVID19, notably the difference b/w FACTS v OPINIONS","DFW, Texas"
11,"Utah","3,205,958","82,170","2,727",44,63.695,0,1243351672245506048,"en","Me brewing up my morning brew and settling into two hours of panic reading corona news","Utah, USA"
367,"Texas","28,995,881","261,232","7,365",43,51.175,0,1244123898268061696,"en","TWO DAYS AFTER THE IMPEACHMENT VOTE, AFTER BEING BRIEFED ON THE CORONAVIRUS, TRUMP HAD 17.8 TONS OF HOSPITAL PROTECTIVE GE","Sugar Land, Texas "
3191,"New York","19,453,561","47,126","7,429",32,50.4707692307693,4,1243350475728011264,"en","COVIDs effects are complex and emergent. For example, Chuck E. Cheese delivers now.","New York, NY"
814,"California","39,512,223","155,779","7,916",5,53.6392857142857,0,1243565267407405056,"en","Six-year-old Miumiu performing Fly Me to the Moon in Nanjing, China several weeks ago.","California, USA"
367,"Texas","28,995,881","261,232","7,365",43,45.0657894736842,0,1243350661611302912,"en","Trump team failed to follow NSCs pandemic playbook prepared by the Obama administration containing 69 pages that was finis","Texas, USA"
3191,"New York","19,453,561","47,126","7,429",32,20.38,0,1243540109686902784,"en","Tonight #DeborahBirx stated that models anticipating large-scale transmission of COVID-19 do not match reality on the ground","New York, NY"
62,"Oregon","4,217,737","95,988","2,391",37,58.4075,0,1243327970531356672,"en","May I add that @realDonaldTrump dismantled the pandemic response set up by Obama &amp; was briefe","Oregon"
62,"Oregon","4,217,737","95,988","2,391",37,92.2140909090909,0,1243340121094500352,"en","As Donald Trump states, ""How the world has changed"", Mike Pence bows his head and looks down to his right the quadrant","Oregon, USA"
367,"Texas","28,995,881","261,232","7,365",43,82.39,0,1243544769541914624,"en","Amen and Amen! God and country come first!","El Paso, Texas"
3191,"New York","19,453,561","47,126","7,429",32,39.225,1,1243548036602761216,"en","@ari_russian Good morning &amp; happy Friday 2U pretty Ari. You have the right attitude. Social distancing gives U some me-time &amp; also you'll know who your friends are. They are those who contact you via other means to see how you are doing. Wish you have a wonderful day. Take care &amp; stay safe.","New York, USA"
814,"California","39,512,223","155,779","7,916",5,112.085,0,1236754048931508224,"en","aiiight thats it! This shit has gone tooo far now!","California, USA"
367,"Texas","28,995,881","261,232","7,365",43,42.865,0,1241111947736764416,"en","Inside, immigrants are on hunger strike. Theyre desperate to be released, before COVID turns detention centers into de","Texas, USA"
814,"California","39,512,223","155,779","7,916",5,71.815,2,1241117396204548096,"en","This is pretty accurate minus the oink oinks","California, USA"
312,"Ohio","11,689,100","40,861","3,965",35,88.5633333333333,0,1244130194069377024,"en","My mom and dad are in their 70s they both have COVID.. they are not doing well, I pray all day that not only them but e","Ohio, USA"
62,"Oregon","4,217,737","95,988","2,391",37,53.7595454545455,0,1244136221602803712,"en","Wonder if Dr. Birx would like to revise and extend her remarks that any American who needs a ventilator or hospital bed","Oregon High Desert"
814,"California","39,512,223","155,779","7,916",5,53.12,0,1236752908630265856,"en","coronavirus made flights so cheap yall can finally afford to hang out with your internet boyfriend","California, USA"
477,"Connecticut","3,565,278","4,842","701",7,56.6057142857143,0,1234060518559801344,"en","Dear libs, How can you be scared of the Coronavirus when you also support open borders &amp; unvetted migrants with deadly","Connecticut, USA"
312,"Ohio","11,689,100","40,861","3,965",35,120.205,1,1241116951403016192,"en","Nailed it","Ohio, USA"
169,"Virginia","8,535,519","39,490","3,285",46,79.94,0,1237755674412670976,"en","This C-19 is a bunch of crap. People, need and Dems are totally over reacting. They wants this 2 b bad 2 beat Trump. Ri","Virginia, USA"
822,"Illinois","12,671,821","55,519","2,395",13,33.465,0,1244697959859552256,"en","Wisconsin voters have flooded local election officials with absentee ballot requests as the state's April 7 primary rap","Chicago-Illinois "
367,"Texas","28,995,881","261,232","7,365",43,82.2966666666667,0,1236570952638570496,"en","My fever is now above 100. The ERs and urgent care sites have no tests. The closest ER asked me to hold on when I called ahe","Alvarado, Texas"
1736,"Michigan","9,986,857","56,539","40,175",22,34.255,0,1237767095322120192,"en","11:45 AM - It has become exponentially harder to keep up with updating this US university coronavirus map... the latest a","Michigan, USA"
1736,"Michigan","9,986,857","56,539","40,175",22,42.865,0,1239647414144741376,"en","Respirators, ventilators, all of the equipment try getting it yourselves, Mr. Trump told the governors during the co","Michigan, USA"
367,"Texas","28,995,881","261,232","7,365",43,71.7678571428572,0,1237546432980062208,"en","Me not taking the corona virus serious yet while the world is in shambles","Texas, USA"
510,"Washington","7,614,893","66,456","4,842",47,55.405,0,1237558189442207744,"en","So much wrong with US thinking. 1. The 10K troops were never necessary because Irans next move will be unconventional","Washington, DC"
312,"Ohio","11,689,100","40,861","3,965",35,73.1421739130435,0,1237552229655035904,"en","If you only learn one thing about #COVID19 today make it this: everyone's job is to help FLATTEN THE CURVE. With thanks to @","Ohio, USA"
436,"Indiana","6,732,219","35,826","593",14,61.325,0,1237552905147707392,"en","Keep yourself and those around you safe from the Coronavirus:","Indiana, USA"
367,"Texas","28,995,881","261,232","7,365",43,50.665,0,1239647883709816832,"en","Idris when he got his Coronavirus results back","Houston, Texas"
814,"California","39,512,223","155,779","7,916",5,-8.72499999999999,4,1238906884490285056,"en","Grim but likely anticipation."," Hollywood, CA USA citizen"
626,"Florida","21,477,737","53,625","12,133",9,36.1605263157895,0,1242774259304366080,"en","Joining @Morning_Joe this morning from the White House to discuss the latest developments of the coronavirus pandemic. Tune in.","the Florida Sunshine"
822,"Illinois","12,671,821","55,519","2,395",13,51.175,0,1241799435828506624,"en","Trump used his Twitter feed to hype an untested treatment for coronavirus, and now lupus patients can't get their medicati","Illinois, USA"
367,"Texas","28,995,881","261,232","7,365",43,49.9140909090909,0,1238317261997342720,"en","The Obama White House had to immediately issue an apology for Joe Bidens remarks, and any alarm that he might have c","Texas, USA"
367,"Texas","28,995,881","261,232","7,365",43,55.405,0,1241793119168933888,"en","JUST IN: @COSAGOV announces 45 confirmed COVID-19 cases in Bexar County. Of those cases, 10 are community spread. Latest here.","San Antonio, Texas"
37,"Iowa","3,155,070","55,857","416",15,38.165,0,1242686866727583744,"en","The White House plans to promote unproven coronavirus treatments. Oracle is involved. So is Jared Kushner. @noahweiland @mag","Urbandale, Iowa, USA"
436,"Indiana","6,732,219","35,826","593",14,44.405,0,1242768311936585728,"en","Indy Parks and Rec says employee tested positive for coronavirus","Indianapolis, IN"
510,"Washington","7,614,893","66,456","4,842",47,51.175,0,1234651736003866624,"en","ARREST THIS SICK BASTARD Obama Holdover Made the Call to Fly Coronavirus Patients Back to the US from Japan - Then","Seattle, Washington"
79,"North Carolina","10,488,084","48,618","5,201",33,39.3192857142857,5,1242682173704015872,"en","Quit doing push-ups, nobody cares. Nobody wants to see and ugly picture of you you when you were 9 for 24 hours and quit posting dogs.....actually keep posting your dogs....dogs and memes are the only things allowed on instagram during this pandemic","North Carolina, USA"
312,"Ohio","11,689,100","40,861","3,965",35,48.5485714285714,0,1235297763803488256,"en","Trump blames Obama for coronavirus because hes nuts and any reporter who covers this President as if this is normal is","Ohio"
0,"North Dakota","762,062","69,001","1,698",34,61.4504545454545,0,1234864350181105664,"en","If ever there was evidence the @GOP is detached from reality, its their gaslighting and denial of the serious threat of th","North Dakota, USA"
3191,"New York","19,453,561","47,126","7,429",32,38.165,0,1234863033094221824,"en","A NYC high school is closing today after a suspected coronavirus case in the community, according to Reuters.","New York, NY"
367,"Texas","28,995,881","261,232","7,365",43,46.9450000000001,0,1235294312046436352,"en","BREAKING: Hill negotiators just reached $8.3B emergency coronavirus deal. It should pass House and Senate by Friday. This is ov","Texas"
312,"Ohio","11,689,100","40,861","3,965",35,51.175,0,1234856813180354560,"en","A student whose classmates met with and touched VP Pence is now quarantined. On Friday, cadets at Sarasota Military A","GH, OH "
3725,"New Jersey","8,882,190","7,354","1,368",30,64.6628571428572,0,1234808486929870848,"en","BREAKING: Trump just told the press that a Coronavirus vaccine will be ready in 3-4 months. Seconds later, in the same","New Jersey, USA"
436,"Indiana","6,732,219","35,826","593",14,65.7856521739131,0,1234865474967670784,"en","I live in Seattle, I have all symptoms of COVID-19 and have a history of chronic bronchitis. Since I work in a physic","Indianapolis, IN"
510,"Washington","7,614,893","66,456","4,842",47,24.44,0,1234863009471848448,"en","Federal Reserve cuts interest rate in bid to stop coronavirus tanking US economy","Washington, DC."
814,"California","39,512,223","155,779","7,916",5,71.7815789473684,0,1242629614800752640,"en","on why we aren't playing sound from Trump today: In the midst of a global pandemic, the President went","California, USA"
312,"Ohio","11,689,100","40,861","3,965",35,94.3,0,1242838071046963200,"en","Leading the pack for top Headlines of the Day","Puck Bunny Farm - Cable, Ohio"
152,"Missouri","6,137,428","68,742","965",25,63.4861538461539,0,1241646377345650688,"en","in December, January, February and did not act, lied, and now blames China","Kansas City, Missouri"
167,"Wisconsin","5,822,434","54,158","11,339",49,65.7856521739131,0,1242619183508135936,"en","Criticized for his failure to ramp up a fast response to coronavirus, Trump goes back to a standby he knows his base loves:","SE & SW, Wisconsin"
510,"Washington","7,614,893","66,456","4,842",47,64.9245454545455,0,1242629912265019392,"en","Levine is chairman of the New York City council health committee.","Washington, USA"
53,"Kansas","2,913,314","81,759","520",16,38.485,0,1238469737379659776,"en","Photos of the Week: Hungry Deer, Homer Homer, Arabian Oryx - 35 images from the past seven days, including coronavirus pre","Kansas City, KS"
367,"Texas","28,995,881","261,232","7,365",43,72.325,0,1238479514331725824,"en","Trump blocked #COVID19 tests so that the number of cases reported would stay low, after he fired the pandemic response","Texas, USA"
167,"Wisconsin","5,822,434","54,158","11,339",49,77.8107142857143,0,1238265499806466048,"en","Katie Porter is a national treasure and what she just did will save lives.","Milwaukee, Wisconsin"
62,"Oregon","4,217,737","95,988","2,391",37,97.025,0,1238941424311103488,"en","Read this entire thread...","Medford, Oregon"
477,"Connecticut","3,565,278","4,842","701",7,50.665,10,1238469338866343936,"en","Why soap worksanother explainer from @13pt &amp; @ferrisjabr","Connecticut"
21,"New Mexico","2,096,829","121,298","292",31,83.32,0,1240385091328544768,"en","A Chinese virus, you say?","Santa Fe, New Mexico"
814,"California","39,512,223","155,779","7,916",5,63.865,0,1239617168766947328,"en","Heard an alarming report that going to emergency room with symptoms and then sent away without testing cost $1,500 for","California, USA"
3725,"New Jersey","8,882,190","7,354","1,368",30,16.6541463414634,0,1239617571399389184,"en","@msbcw @heckyessica @juliebosman @jmartNYT For most people, the new coronavirus causes only mild or moderate symptoms, such as fever and cough. For some, especially older adults and people with existing health problems, it can cause more severe illness, including pneumonia -AP","New Jersey, USA"
3191,"New York","19,453,561","47,126","7,429",32,11.13,0,1244540057693888512,"en","The #Coronavirus is acting like an unwelcome Olympics for scientists, doctors, engineers, entrepreneurs, techies, leade","New York"
