"total_march_covid_deaths","Name","Population","Land.area.mi.2.","Water.area.mi.2.","state_num","flesch","favorite_count","id","lang","text","user_location"
814,"California","39,512,223","155,779","7,916",5,52.4965789473684,3,1229166092834107392,"en","@sh_irredeemable @SenTomCotton If Nixon hadnt have gone to China, they would have collapsed under their own weight before the 1980s. Ford didnt have time to go &amp; Carter wouldnt have had the balls. Todays China: We built that.","Southern California"
626,"Florida","21,477,737","53,625","12,133",9,78.8728571428572,0,1227278373908615168,"en","Too damn weird. Do birds carry corona?","Florida, USA"
626,"Florida","21,477,737","53,625","12,133",9,42.715,0,1227278506507173888,"en","Fed Chair Jay Powell, to lawmakers: ""We are closely monitoring the emergence of the #coronavirus, which could lead to dis","Florida, USA"
76,"Minnesota","5,639,632","79,627","7,309",23,49.48,1,1227076529248702464,"en","#coronavirus This is not good.","Minnesota, USA"
477,"Connecticut","3,565,278","4,842","701",7,42.715,0,1229166649493934080,"en","NO. #SARSCoV2 #COVID19 did not originate in the BSL4 lab in Wuhan. It almost certainly originated naturally in wild ba","Torrington, CT + Brooklyn, NY "
626,"Florida","21,477,737","53,625","12,133",9,72.6154545454546,0,1229176594440347648,"en","Make this go viral. China is on the brink of revolution.","Florida, Space Coast, USA"
111,"South Carolina","5,148,714","30,061","1,960",40,57.605,0,1230632462679773184,"en","Anyone else sick of seeing fake news lie about Tom Cotton? He's right about the origins of the corona-virus. He's right about","South Carolina, USA"
626,"Florida","21,477,737","53,625","12,133",9,55.405,0,1232856013944033280,"en","He's got a certain talent for this."" Mike Pence &amp; his christofascist Indiana GOP literally killed thousands, with one of","nyc * FL born"
173,"Arizona","7,278,717","113,594","396",3,50.3827027027027,4,1232302548159123456,"en","Since COVID-19 kills mostly old people and people with health problems, if nothing at all was done to contain it (like 2,000 years ago), would we end up with a 2% smaller population that is #healthier? #coronavirus","Morristown (Phoenix), Arizona"
0,"West Virginia","1,792,147","24,038","192",48,59.635,0,1224165817971019776,"en","1. As always, GOPrs ignore experts &amp; instead are adopting ""Fox News/Ann Coulter/Sounds Good to Me"" rules for dealing wi","West Virginia, USA"
1736,"Michigan","9,986,857","56,539","40,175",22,35.3094117647059,0,1224177806399221760,"en","It's in interest of our loved ones: Pakistan decides not to airlift its citizens from Coronavirus-hit China.","Lake Michigan shore"
312,"Ohio","11,689,100","40,861","3,965",35,49.3907142857143,1,1227952880092667904,"en","Anything for a buck. This should be a clear sign that they really don't care what happens to their followers as long as they send in their money. The evangelical right, the GOP, 45, #MoscowMitch... All of them. They don't care. #VoteBlue2020","Ohio, USA"
499,"Georgia","10,617,423","57,513","1,912",10,48.5485714285714,0,1227841583661404160,"en","Random, but important to remember: Hillary having a private server is one thing, but having SAPs on her private server is","Georgia, USA"
367,"Texas","28,995,881","261,232","7,365",43,118.175,0,1232277640133988352,"en","That door is LOCKED.","Texas, USA"
11,"Utah","3,205,958","82,170","2,727",44,51.175,0,1227950175076798464,"en","The F.B.I. is investigating Harvard &amp; Yale for failing to report funds provided by Communist China . Next time you hea","Utah, USA"
3725,"New Jersey","8,882,190","7,354","1,368",30,75.1211764705883,0,1224367456921300992,"en","How much did the Chinese know about Coronavirus when they signed that deal in the East Room.","New Jersey, USA"
510,"Washington","7,614,893","66,456","4,842",47,3.345,0,1224366709781467136,"en","Novel #coronavirus: guidance for primary care","Washington DC USA"
1736,"Michigan","9,986,857","56,539","40,175",22,46.9450000000001,0,1224841796754247680,"en","State and local law enforcement are on the front lines combatting the opioid epidemic. It's imperative they have the res","Michigan, USA"
27,"New Hampshire","1,359,711","8,953","397",29,61.665,0,1233646987981082624,"en","Stormy Daniels. Hoax! * Muslim ban. Hoax! * 23 woman accuse him of sexual assault. Hoax! * Friends with Jeffrey Epstein.","Plymouth, New Hampshire"
3725,"New Jersey","8,882,190","7,354","1,368",30,72.325,0,1224838670492078080,"en","Normal? These are trained LEO prepping fire arms and automatic rifles to round up ""infected"" people? Where is the threat?","Cinnaminson, NJ  USA"
822,"Illinois","12,671,821","55,519","2,395",13,49.5184210526316,0,1232872406064205824,"en","Ive seen Democrats be tougher on Trump for his coronavirus response than theyve been on China, whose communist governme","Marion, Illinois"
3191,"New York","19,453,561","47,126","7,429",32,35.3094117647059,0,1233735906160529408,"en","US sanctions have prevented Iran from buying Coronavirus testing kits, allowing the disease to spread unhindered. Sancti","New York, NY"
98,"Kentucky","4,467,673","39,486","921",17,25.455,0,1230617912530087936,"en","How to Combat the Coronavirus with Proper Hand Washing | Frequent Business Traveler","Florence, Kentucky USA"
150,"Alabama","4,903,185","50,645","1,775",1,45.0657894736842,0,1233730870143524864,"en","President Trump is 100% right. Democrats attempting to score political points off coronavirus are trying to pull off ano","South Alabama"
1736,"Michigan","9,986,857","56,539","40,175",22,53.971052631579,0,1227272126920523776,"en","Sick: Border Patrol officers intercepted a passenger from China carrying 200 dead birds in his suitcase He was trying","Michigan, USA"
3191,"New York","19,453,561","47,126","7,429",32,5.45058823529416,0,1227056165370159104,"en","After criticizing President Obama's handling of the Ebola outbreak, President Trump now confronts another epidemic in the","New York"
814,"California","39,512,223","155,779","7,916",5,28.765,0,1227058773757349888,"en","trump is unfit to lead - he should be impeached for firing the Vindman brothers #VindmanIsAHero #CoronavirusOutbreak is real - #","California, USA"
173,"Arizona","7,278,717","113,594","396",3,59.635,0,1229178750073335808,"en","This is spooky. A book first published back in 2008 had apparently predicted a ""pmeumonia-like"" outbreak across the globe i","Southern Arizona"
367,"Texas","28,995,881","261,232","7,365",43,78.245,0,1228980691699994624,"en","Bloomberg would be a disaster for our country he would","Deep in the  of Texas"
1736,"Michigan","9,986,857","56,539","40,175",22,61.89,0,1227245800453017600,"en","NPR: Will Coronavirus Quarantines Help Or Hurt? A Look Back At Leprosy : Shots Health News","Michigan"
814,"California","39,512,223","155,779","7,916",5,57.605,0,1227243145580040192,"en","A Japanese cruise liner with more than 3,000 people on board was in quarantine Tuesday after a passenger, who had already le","Tijuana Baja California Mxico"
859,"Pennsylvania","12,801,989","44,743","1,312",38,51.175,0,1227034160142966784,"en","The President frequently talks about how much he admires authoritarians and that he wishes we could emulate them and it's","Lancaster County, PA "
312,"Ohio","11,689,100","40,861","3,965",35,60.6342857142857,0,1227241416763625472,"en","The coronavirus death toll passed 1,000 in China, after 100+ deaths recorded in a single day. What we know: Mortality rate","Cleveland, OH "
62,"Oregon","4,217,737","95,988","2,391",37,58.4291304347826,0,1232838640855683072,"en","When Mike Pence was governor of Indiana, his public health record was so stellar that his state policy led directly to a l","Oregon, USA"
79,"North Carolina","10,488,084","48,618","5,201",33,52.5771428571429,0,1233057556060409856,"en","Hubby went for regular check up today &amp; asked our Doc his assessment of the Coronavirus. Exact words Its nothing wo","North Carolina, USA"
367,"Texas","28,995,881","261,232","7,365",43,30.9476923076923,0,1232832773653770240,"en","CDC confirms the first US coronavirus case of unknown origin, in northern California","Texas, USA"
367,"Texas","28,995,881","261,232","7,365",43,49.5184210526316,0,1233058767333445632,"en","Iran's Vice President, who once served as spokeswoman for the hostage-takers following the 1979 siege of the U.S. embass","My Heart Is Always In Texas"
53,"Kansas","2,913,314","81,759","520",16,20.38,0,1225493989333270528,"en","Attorney General William Barr is warning about China's continuing advancements in global 5-G technology -- news at 1:00.","Wichita, Kansas"
3191,"New York","19,453,561","47,126","7,429",32,59.635,0,1226082356722896896,"en","A United States citizen has died from the new coronavirus in Wuhan, China, in what appeared to be the first","New York, NY"
3191,"New York","19,453,561","47,126","7,429",32,86.705,0,1233052999494316032,"en","Me: ""I think I have the Corona Virus"" School Nurse:","New York, USA"
814,"California","39,512,223","155,779","7,916",5,80.6777272727273,0,1233703459649511424,"en","I couldn't believe it when Trump put Pence, a walking waxwork who also doesn't believe in science, in charge of the co","California, USA"
367,"Texas","28,995,881","261,232","7,365",43,66.365,0,1233606370085265408,"en","Trying to blame Trump for the Coronavirus, would be like trying to blame Rosie ODonnell for World Hunger.","Granbury, Texas"
436,"Indiana","6,732,219","35,826","593",14,53.655,0,1233610438950125568,"en","Just wait til Trump supporters find out coronavirus also kills white people.","Indianapolis, IN"
859,"Pennsylvania","12,801,989","44,743","1,312",38,45.2623529411765,0,1233606243534680064,"en","This tweet is a reminder that @realDonaldTrump also demanded that @TheDemocrats cut $37,000,000 from Heating Assistance Pro","Pennsylvania, USA"
814,"California","39,512,223","155,779","7,916",5,49.5184210526316,0,1233609584486408192,"en","PSA for non-science folks: Wonder why everyone is emphasizing hand washing? Sounds banal, but soap really IS an amazin","Goat Hill, California"
105,"Tennessee","6,829,174","41,235","909",42,57.605,0,1232254765771493376,"en","According to @cvpayne - the stock markets dive isnt due to corona virus; its the direct result of Bernie taking a solid lea","Kingsport, TN "
3191,"New York","19,453,561","47,126","7,429",32,64.6628571428572,0,1228386600922550272,"en","This is what it's like to catch the coronavirus. This 21-year-old student in Wuhan who was diagnosed with the virus shares","New York City"
1736,"Michigan","9,986,857","56,539","40,175",22,69.4639130434783,0,1232158118488018944,"en","Notably on the day the stock market traded down more than 1,00 points over fears of the spread of the coronavirus, the pos","Michigan"
499,"Georgia","10,617,423","57,513","1,912",10,-0.423043478260837,0,1228405474858586112,"en","#Nowplaying on #KISAPublicRadio: The China Africa Project - Chinese Investment and Labor Practices in Ethiopia. Thank you for listening. #publicradio #interview #news #radio #journalism","Georgia"
37,"Iowa","3,155,070","55,857","416",15,46.9450000000001,0,1232158408754835456,"en","Doctors Im speaking to are asking how its possible countries neighboring or near to China (India/ Indonesia) have few o","Iowa, USA"
510,"Washington","7,614,893","66,456","4,842",47,-9.09999999999999,0,1232271014471430144,"en","Senate-wide briefing this morning by the administration on coronavirus","Washington, USA"
436,"Indiana","6,732,219","35,826","593",14,62.1073913043478,0,1232271342390693888,"en","Coronavirus isn't the only thing to blame for today's 1000 point Dow drop. It was only a matter of time before Trump's econom","Northern Indiana"
53,"Kansas","2,913,314","81,759","520",16,37.4553846153846,0,1224614885083971584,"en","former EU envoy to South Korea, was able to prevent Chinese #dissient/#activist #LiuXia,","Wichita, Kansas"
398,"Colorado","5,758,736","103,642","452",6,49.5184210526316,0,1224793218144821248,"en","Hong Kong reported its first #coronavirus death, the second outside mainland China from a fast-spreading outbreak that has kil","Northern Colorado"
814,"California","39,512,223","155,779","7,916",5,78.8728571428572,0,1230606509802844160,"en","But there is nothing to worry about...","California, USA"
62,"Oregon","4,217,737","95,988","2,391",37,47.394347826087,0,1233625817298530304,"en","I am just off the phone with @OHAOregon Director Pat Allen for a briefing on the first diagnosed case of coronavirus in Orego","Portland Oregon"
510,"Washington","7,614,893","66,456","4,842",47,51.175,0,1233632552667287552,"en","If you believe @realDonaldTrumps words about the new hoax, then you are really stupid. Just today new #coronavirus cases we","Washington state "
398,"Colorado","5,758,736","103,642","452",6,47.394347826087,0,1233626898942423040,"en","@DavidShuster Sounds a bit dramatic but I guess we'll see. Is he talking about common cold coronavirus? Because I just got over that.","Colorado, USA"
3191,"New York","19,453,561","47,126","7,429",32,56.6057142857143,0,1232832254826688512,"en","The man who cut funding for the clean needle program in Indiana that single-handedly caused an HIV-AIDS outbreak has been pu","New York, NY"
0,"North Dakota","762,062","69,001","1,698",34,-4.34999999999997,5,1232820556132765696,"en","Ivanka is working on the coronavirus vaccine, supervised by coronavirus czar and supreme medical expert Mike Pence. Nobody panic. Were gonna be okay! #coronavirususa","North Dakota, USA"
510,"Washington","7,614,893","66,456","4,842",47,51.175,0,1233623582309150720,"en","To keep everyone informed, we have confirmed case of COVID-19 at Jackson HS. We are in ongoing communication w/ @WADept","Seattle, Washington"
3725,"New Jersey","8,882,190","7,354","1,368",30,57.2336363636364,0,1230604243754770432,"en","Coronavirus spike protein just mapped, leading way to vaccine | Live Science","New Jersey"
898,"Massachusetts","6,892,503","7,800","2,754",21,47.394347826087,0,1233621342806777856,"en","South Korea calls Coronavirus a crisis. Canada calls it a crisis. The UK calls it a crisis. Germany calls it a crisis. Japan","Massachusetts, USA"
510,"Washington","7,614,893","66,456","4,842",47,3.25521739130437,4,1232832639457005568,"en","@AkilahObviously dont forget about how mike pence unilaterally decided to withhold a needle exchange program in indiana that exacerbated the rural HIV epidemic","Washington, DC"
367,"Texas","28,995,881","261,232","7,365",43,-29.1949999999999,3,1232820874350383104,"en","Trump dissing @SpeakerPelosiis Unfuckingbelievable. While we face problems dealing w/ Coronavirus because Trump dismantled our response department for pandemics. #CoronaVirusUpdates","Texas, USA"
367,"Texas","28,995,881","261,232","7,365",43,78.8728571428572,0,1230600394876817408,"en","But there is nothing to worry about...","Texas, USA"
3191,"New York","19,453,561","47,126","7,429",32,35.948,290,1229138385828225024,"en","Though there are only a few known cases in the U.S., the coronavirus outbreak has left some Asian-Americans feeling an unsettling level of public scrutiny","New York City"
0,"Alaska","731,545","570,641","94,743",2,46.0686363636364,0,1226237229602754560,"en","Hey @PeteButtigieg is totally right! I'm very worried about meeting the moment esp. with what's happening in China right now. I k","Alaska, USA"
76,"Minnesota","5,639,632","79,627","7,309",23,55.405,0,1226063853047472128,"en","A touching moment was captured when Chen Ying, a nurse working in a quarantined hospital ward in eastern China's Zhejiang","Minnesota, USA"
169,"Virginia","8,535,519","39,490","3,285",46,18.4442857142857,0,1225504354670718976,"en","HENN Designs Sino-French Aeronautics Campus in China","Richmond, VA | Kuwait"
510,"Washington","7,614,893","66,456","4,842",47,65.2959090909091,0,1227259946883923968,"en","I will call out Bloomberg on race-basing anti-gun policies the same way I called out Yang for saying white people will sh","Seattle, Washington"
814,"California","39,512,223","155,779","7,916",5,31.97,0,1227246098038710272,"en","Russia Planning to Build Powerful New Supercomputers After Seeing Its Technology Lag Behind U.S. And China","California, USA"
814,"California","39,512,223","155,779","7,916",5,67.3289473684211,0,1227036553681092608,"en","Things that make you go Hmmmmm: Coronavirus came out, protesters went away. (someone else thought of this, just sharing)","California, USA"
1736,"Michigan","9,986,857","56,539","40,175",22,69.1413636363636,0,1229855372648886272,"en","Prayers for the people of China. The Coronavirus was leaked on purpose to stop the protests. And now they are being r","Michigan, USA"
814,"California","39,512,223","155,779","7,916",5,57.605,0,1227095053547401216,"en","Cutting the CDC in the middle of a pandemic is not viable in a functioning republic. We do not currently have one.","California, USA"
436,"Indiana","6,732,219","35,826","593",14,53.971052631579,0,1227198813368201216,"en","Sick: Border Patrol officers intercepted a passenger from China carrying 200 dead birds in his suitcase He was trying","Indiana, USA"
169,"Virginia","8,535,519","39,490","3,285",46,30.3329411764706,0,1229876306269044736,"en","BREAKING: Trump Administration is declaring Chinese state media in US ""offices of foreign missions,"" meaning personnel, p","Virginia"
21,"New Mexico","2,096,829","121,298","292",31,72.9868181818182,0,1227097140301713408,"en","Feb 10, 2020 - Information for 18 cases of #2019nCoV in Malaysia as 5pm today. Out of 18 cases, six are Malaysians an","New Mexico, USA"
814,"California","39,512,223","155,779","7,916",5,53.7595454545455,0,1223399726231326720,"en","GREAT NEWS. We are told that our article helped move the needle as the US government has taken the rational precautionary mea","Northern California"
1736,"Michigan","9,986,857","56,539","40,175",22,41.2367567567568,6,1226213150678306816,"en","@schmidci @CDCgov I've been watching coronavirus reports from places like Singapore, where there are cases. That reporting is more transparent, honest, helpful, more grownup than what we're getting in the US. CDC is dropping the ball again.","Michigan, USA"
367,"Texas","28,995,881","261,232","7,365",43,61.89,0,1233567749512798208,"en","Canada Dry dropping a loud pack just in time to combat coronavirus. Look at that.","Texas, USA"
367,"Texas","28,995,881","261,232","7,365",43,76.8322727272727,0,1226212031239524352,"en","On Johns Hopkins virus dashboard: Not sure what it means, but striking that 722 of current 724 deaths are in mainland Ch","Plano, Texas (Dallas Suburb)"
125,"Mississippi","2,976,149","46,923","1,508",24,-27.6215384615384,0,1230569163845816320,"en","No explanation as to how #coronavirus made it to Iran. #coronaviruschina #COVID19 #WuhanCoronavirus","west of the Mississippi"
152,"Missouri","6,137,428","68,742","965",25,4.55769230769232,1,1233770599190679552,"en","@MoooPapa @Twin_Travel You're absolutely correct! The #MockingbirdMedia #PropagandaOutlets have ginned this Coronavirus up and have further brainwashed their radical, far-left liberal audience into believing that this is worse than to seasonal flu that kills 2000 to 4000 americans yearly!","Missouri, USA"
626,"Florida","21,477,737","53,625","12,133",9,61.4504545454545,0,1232976001556193280,"en","Claims Trump lied in his press conference yesterday about the coronavirus just to make the stock market go up. I'll take t","Florida, USA"
12,"Arkansas","3,017,804","52,035","1,143",4,36.6637837837838,0,1230574567560818688,"en","""This study found that the age-adjusted percentage of current (informal, unpaid) caregivers who reported that their health was fair or poor was nearly 20%, with estimates ranging as high as one third in Arkansas and Puerto Rico.""","Arkansas"
499,"Georgia","10,617,423","57,513","1,912",10,55.2152941176471,0,1233783571959160832,"en","Pres@realDonaldTrump Could Suck The Coronavirus Out Of 60,000 People &amp; He'd Still Be Criticized But the tr","Georgia USA"
113,"Nevada","3,080,156","109,781","791",28,35.3094117647059,0,1232889167387877376,"en","Russia Russia Russia - Quid-pro-quo - Russia Russia Russia - CoronaVirus Holy shit give it a rest. Trump's your preside","Nevada, USA"
626,"Florida","21,477,737","53,625","12,133",9,47.9132352941177,0,1233783231276834816,"en","@SecAzar @BillHemmer GOD BLESS YOU MR. AZAR - BEST SUCCESS IN SMASHING THE CORONA VIRUS I BELIEVE IN YOU AND YOUR TEAM AND I PRAY YOU QUICKLY RESOLVE AND NEUTRALIZE THIS THREAT TO HUMANS &lt;3","South Florida, USA"
626,"Florida","21,477,737","53,625","12,133",9,33.575,0,1232320872461021184,"en","Carnival Clown barking again.","Florida  "
822,"Illinois","12,671,821","55,519","2,395",13,64.6628571428572,0,1232331809981071360,"en","Donny fired the whole CDC that deals with a global health crisis. Why would anyone believe he has anything under cont","Illinois, USA near St Louis"
3191,"New York","19,453,561","47,126","7,429",32,49.9140909090909,0,1224197574699180032,"en","At the time of Jared Kushner's secret meeting in China, the Kushner family was under fire for its pursuit of overseas investo","Brooklyn, NY USA"
814,"California","39,512,223","155,779","7,916",5,29.18,0,1231309779399671808,"en","#coronavirus is incredibly infectious. The world needs to mount a massive effort to thwart the worst possible impacts of this #zoonotic #disease. #CoronaOutbreak #COVD19 #2019_nCov","California, USA"
367,"Texas","28,995,881","261,232","7,365",43,-15.6175,0,1224200079327813632,"en","Police admonishing woman for posting info about #Coronarivus on #socialmedia, saying everywhere in China, only authoriti","Houston, Texas"
499,"Georgia","10,617,423","57,513","1,912",10,76.8322727272727,0,1231312213102735360,"en","Should read - After 100% support from millions of MAGA voters for years, Clint Eastwood sells them all out, and the USA, for","Georgia, USA"
105,"Tennessee","6,829,174","41,235","909",42,62.8763157894737,0,1228437530724401152,"en","First, they covered up the truth, second, they said this disease was preventable and controllable, third, they locked yo","Tennessee"
626,"Florida","21,477,737","53,625","12,133",9,30.53,0,1227745338917679104,"en","Coronavirus gets official name from WHO: COVID-19","Sur de la Florida"
3191,"New York","19,453,561","47,126","7,429",32,35.5107142857143,0,1228257418813071360,"en","Are the Chinese Assassinating those Sick with the Coronavirus that Refuse to be Evacuated?","New York, NY"
510,"Washington","7,614,893","66,456","4,842",47,46.9450000000001,0,1227958232049565696,"en","Communist Party has put #HongKong and now the entire world at risk because of the #coronavirus, very much including th","Seattle WA USA"
3191,"New York","19,453,561","47,126","7,429",32,40.09,0,1232314170403696640,"en","Jabil expects softer Q2 due to coronavirus $JBL","New York, NY"
3191,"New York","19,453,561","47,126","7,429",32,50.665,0,1227763741745438720,"en","Coronavirus: More than 14,800 new cases reported yesterday","New York City"
79,"North Carolina","10,488,084","48,618","5,201",33,45.0657894736842,0,1232314543671517184,"en","The Trump Administrations failure to take Cornavirus seriously is so frightening. It will cost lives. Many of us were","North Carolina, USA"
367,"Texas","28,995,881","261,232","7,365",43,64.6628571428572,0,1232998356504502272,"en","The dont test, dont tell policy of the CDC came crashing down tonight. Community transmission is here in the US, an","Texas, USA"
626,"Florida","21,477,737","53,625","12,133",9,55.575,1,1232993748352733184,"en","The CDC reported the first case of coronavirus infection in a person who had no known source of contact with the virus. via @HuffPostPol","South Florida, USA"
626,"Florida","21,477,737","53,625","12,133",9,35.5107142857143,0,1.224274775046e+18,"en","China says US hasn't given any significant help in coronavirus outbreak, created panic: report","Florida, USA"
3191,"New York","19,453,561","47,126","7,429",32,90.9585714285714,0,1224272680087687168,"en","BREAKING NEWS (and really GREAT news, too):","New York, USA"
312,"Ohio","11,689,100","40,861","3,965",35,37.9,0,1230554983281483776,"en","BREAKING: South Korea reports 1st death from coronavirus - Yonhap","Ohio, USA"
898,"Massachusetts","6,892,503","7,800","2,754",21,44.52,0,1223416051041492992,"en","Add profiting from global pandemics to this administration's laundry list of cruelty. Remember when we were a model to the re","Boston, MA (Roslindale)"
152,"Missouri","6,137,428","68,742","965",25,61.89,0,1230565585672499200,"en","Damn DEMS have probably already sold us out through BLOOMBERG AND BIDEN REMEMBER CHINA 2030?","Missouri, USA"
398,"Colorado","5,758,736","103,642","452",6,64.6628571428572,0,1233767905696698368,"en","Theres much we dont yet know about coronavirus. But we do know that global outbreaks often hit the worlds poorest peop","Denver, Colorado"
152,"Missouri","6,137,428","68,742","965",25,10.4270588235294,0,1233759463322128384,"en","This is a total lie from Politico reporter @nancook. President @realDonaldTrump said attempts to politicize the coronavi","Jackson, MO USA"
859,"Pennsylvania","12,801,989","44,743","1,312",38,36.62,0,1226228775542820864,"en","Scary","Pennsylvania, USA"
510,"Washington","7,614,893","66,456","4,842",47,44.52,0,1225522694906499072,"en","BREAKING: A Chinese doctor who sounded an early warning about the new coronavirus outbreak has died of the illness, hospital says."," Dry side of WA state"
822,"Illinois","12,671,821","55,519","2,395",13,22.7862068965517,0,1226228138595713024,"en","Demonrats approved new articles of impeachment due to Corona virus infections being only in blue states. President Trump countered with this just confirmed Demonrat inability to protect the country.","0.4 miles from IL border IN"
859,"Pennsylvania","12,801,989","44,743","1,312",38,121.22,0,1225524181506371584,"en","Fact.","Pennsylvania, USA"
